SQL> select * from te3149_customer;

CUSTOMER_ID NAME		 DATE_OF_PAYMENT    NAME_OF_SCHEME
----------- -------------------- ------------------ --------------------
    STATUS
----------
	 12 Aditya		 13-NOV-98	    Diamond
	 0

	 13 Mandar		 14-DEC-98	    Gold
	 1

	 14 Neha		 18-DEC-98	    Platinum
	 0


CUSTOMER_ID NAME		 DATE_OF_PAYMENT    NAME_OF_SCHEME
----------- -------------------- ------------------ --------------------
    STATUS
----------
	 15 Prajakta		 01-JUL-98	    Gold
	 1

	 16 Amey		 02-JAN-98	    Bronze
	 1

	 17 Pratik		 20-JUL-18	    Silver
	 1





SQL> declare 
input_name varchar2(20);
input_number number(3);
date1 date;
amt number;
days number;
status_out number;
begin
input_name := '&name';
input_number := &number;
select status into status_out from te3149_customer where input_number=customer_id and input_name=name;
select date_of_payment into date1 from te3149_customer where input_number=customer_id and input_name=name;
select trunc(sysdate) - date1 into days from dual;
amt := 1;
if(status_out=0) then
dbms_output.put_line('Already paid');
elsif (days>30) then
insert into te3149_fine values(input_number, date1, days*50);
update te3149_customer set status=0 where customer_id=input_number;
elsif (days<30 and days>15) then
insert into te3149_fine values(input_number, date1, days*5);
update te3149_customer set status=0 where customer_id=input_number;
elsif(days<15) then
dbms_output.put_line('No fine');
end if;
end;
/  2    3    4    5    6    7    8    9   10   11   12   13   14   15   16   17   18   19   20   21   22   23   24   25   26   27  
Enter value for name: Amey
old   9: input_name := '&name';
new   9: input_name := 'Amey';
Enter value for number: 16
old  10: input_number := &number;
new  10: input_number := 16;



SQL> select * from te3149_fine;

CUSTOMER_ID DATE_OF_FINE	   AMOUNT
----------- ------------------ ----------
	 12 13-NOV-98		   360100
	 16 02-JAN-98		   375850

